{
  "$schema": "https://json-schema.org/draft/2020-12/schema",
  "$id": "https://spatenstich.app/schemas/spatenstich-import.v1.json",
  "title": "Spatenstich Import Payload v1",
  "description": "Datenkontrakt zwischen Claude.ai-Projekt und Spatenstich-App. Emittiert am Ende jeder Foto-Analyse-Session.",
  "type": "object",
  "required": ["schemaVersion", "capture"],
  "additionalProperties": false,
  "properties": {
    "schemaVersion": {
      "const": "spatenstich-import.v1",
      "description": "Versionierung: neue Version = neues Schema-File (D-13). v1 bleibt stabil."
    },
    "capture": {
      "type": "object",
      "required": ["timestamp"],
      "additionalProperties": false,
      "properties": {
        "timestamp": { "type": "string", "format": "date-time" },
        "location": {
          "type": "object",
          "required": ["lat", "lon"],
          "additionalProperties": false,
          "properties": {
            "lat": { "type": "number", "minimum": -90, "maximum": 90 },
            "lon": { "type": "number", "minimum": -180, "maximum": 180 }
          }
        },
        "photoRefs": {
          "type": "array",
          "items": { "type": "string" },
          "description": "Dateiname-Hints, kein Payload"
        },
        "chatReference": { "type": "string", "format": "uri" }
      }
    },
    "beds": {
      "type": "array",
      "items": {
        "type": "object",
        "required": ["localId", "label"],
        "additionalProperties": false,
        "properties": {
          "localId": { "type": "string" },
          "label": { "type": "string" },
          "approxDimensions": {
            "type": "object",
            "additionalProperties": false,
            "properties": {
              "lengthCm": { "type": "number", "minimum": 0 },
              "widthCm": { "type": "number", "minimum": 0 }
            }
          },
          "sunExposure": { "type": "string", "enum": ["full", "half", "shade", "mixed"] },
          "soilNotes": { "type": "string" },
          "confidence": { "type": "number", "minimum": 0, "maximum": 1 }
        }
      }
    },
    "plants": {
      "type": "array",
      "items": {
        "type": "object",
        "required": ["localId"],
        "additionalProperties": false,
        "properties": {
          "localId": { "type": "string" },
          "bedRef": { "type": "string" },
          "scientificName": { "type": "string" },
          "commonNameDe": { "type": "string" },
          "stageEstimate": { "type": "string", "enum": ["seedling", "vegetative", "flowering", "fruiting", "senescent"] },
          "healthNotes": { "type": "string" },
          "confidence": { "type": "number", "minimum": 0, "maximum": 1 }
        }
      }
    },
    "observations": {
      "type": "array",
      "items": {
        "type": "object",
        "required": ["localId", "kind", "summary"],
        "additionalProperties": false,
        "properties": {
          "localId": { "type": "string" },
          "bedRef": { "type": "string" },
          "kind": { "type": "string", "enum": ["pest", "disease", "weather", "soil", "structural", "other"] },
          "summary": { "type": "string" },
          "suggestedActions": { "type": "array", "items": { "type": "string" } }
        }
      }
    },
    "complianceFlags": {
      "type": "array",
      "description": "Optional (D-11) — wird in Phase 10 angezeigt. v1 akzeptiert, ignoriert in UI.",
      "items": {
        "type": "object",
        "required": ["regulation", "status"],
        "additionalProperties": false,
        "properties": {
          "regulation": { "type": "string" },
          "status": { "type": "string", "enum": ["compliant", "warn", "violation"] },
          "note": { "type": "string" }
        }
      }
    },
    "freeFormNotes": {
      "type": "string",
      "description": "Markdown erlaubt, nicht validiert (D-12)."
    }
  }
}
